{
  "id": "code-43",
  "title": "Factorial program generator",
  "category": "coding",
  "goal": "Provide a program that calculates factorial of a number in {language} with example inputs and outputs.",
  "prompt": "Write program in {language} that performs following operations. Example 1: Input: 5 Output: 120 (factorial of 5). Example 2: Input: 7 Output: 5040.",
  "variables": ["language"],
  "tags": ["factorial", "math", "programming"],
  "models_tested": ["gpt-5", "gemini-2.5", "claude-3"],
  "responses": {
    "gpt-5": "Sure! Here's a simple Java program that calculates the factorial of a given number and prints the result. I've also included comments for clarity.\n\n```java\nimport java.util.Scanner;\n\npublic class FactorialCalculator {\n\n    // Method to calculate factorial\n    public static long factorial(int n) {\n        long result = 1; // Use long to handle larger factorials\n        for (int i = 1; i <= n; i++) {\n            result *= i;\n        }\n        return result;\n    }\n\n    public static void main(String[] args) {\n        Scanner scanner = new Scanner(System.in);\n\n        // Prompt user for input\n        System.out.print(\"Enter a number: \");\n        int number = scanner.nextInt();\n\n        // Calculate factorial\n        long fact = factorial(number);\n\n        // Display output\n        System.out.println(\"Factorial of \" + number + \" is: \" + fact);\n\n        scanner.close();\n    }\n}\n```\n\nExample Run:\n```\nEnter a number: 5\nFactorial of 5 is: 120\nEnter a number: 7\nFactorial of 7 is: 5040\n```",
    
    "gemini-2.5": "Here is a Java program that calculates factorial using a method `calculateFactorial`:\n\n```java\nimport java.util.Scanner;\n\npublic class FactorialCalculator {\n\n    public static long calculateFactorial(int n) {\n        if (n < 0) {\n            System.out.println(\"Factorial is not defined for negative numbers.\");\n            return -1;\n        }\n        if (n == 0) return 1;\n\n        long result = 1;\n        for (int i = 1; i <= n; i++) {\n            result *= i;\n        }\n        return result;\n    }\n\n    public static void main(String[] args) {\n        Scanner scanner = new Scanner(System.in);\n\n        System.out.print(\"Enter a non-negative integer: \");\n        if (scanner.hasNextInt()) {\n            int input = scanner.nextInt();\n            long factorialResult = calculateFactorial(input);\n            if (factorialResult != -1) {\n                System.out.println(\"Factorial of \" + input + \" is: \" + factorialResult);\n            }\n        } else {\n            System.out.println(\"Invalid input. Please enter an integer.\");\n        }\n\n        scanner.close();\n    }\n}\n```",
    
    "claude-3": "Here is a Java program that calculates factorial both recursively and iteratively:\n\n```java\npublic class FactorialCalculator {\n\n    // Recursive method\n    public static long factorial(int n) {\n        if (n < 0) throw new IllegalArgumentException(\"Number must be non-negative\");\n        if (n == 0 || n == 1) return 1;\n        return n * factorial(n - 1);\n    }\n\n    // Iterative method\n    public static long factorialIterative(int n) {\n        if (n < 0) throw new IllegalArgumentException(\"Number must be non-negative\");\n        long result = 1;\n        for (int i = 2; i <= n; i++) result *= i;\n        return result;\n    }\n\n    public static void main(String[] args) {\n        int input1 = 5;\n        System.out.println(\"Input: \" + input1);\n        System.out.println(\"Output: \" + factorial(input1) + \" (factorial of \" + input1 + \")\");\n\n        int input2 = 7;\n        System.out.println(\"\\nInput: \" + input2);\n        System.out.println(\"Output: \" + factorial(input2));\n\n        System.out.println(\"\\nAdditional Examples:\");\n        for (int i = 0; i <= 10; i++) {\n            System.out.println(\"Factorial of \" + i + \" = \" + factorial(i));\n        }\n    }\n}\n```"
  },
  "last_updated": "2025-11-03"
}
