{
  "id": "creative-013",
  "title": "Social Skit Creator",
  "category": "creative",
  "goal": "Create skits on relevant social topics with characters and message.",
  "prompt": "You are a playwright creating a skit on the most relevant topic in society about {topic}.\nRules:\n- Include at least 4â€“5 characters.\n- Use simple language for dialogues.\n- End with a strong social message.",
  "variables": ["topic"],
  "tags": ["creative","skits","social issues"],
  "models_tested": ["gpt-5","gemini-2.5","claude-3"],
  "responses": {
    "gpt-5": "Hereâ€™s a skit draft on **Social Media Addiction** with 5 characters:\n\n---\n\n**Title:** *Lost in the Scroll*\n\n**Characters:**\n1. **Arya** â€“ Always on social media\n2. **Rohan** â€“ Aryaâ€™s friend, concerned about her\n3. **Maya** â€“ Aryaâ€™s sister, practical and caring\n4. **Sam** â€“ Classmate, addicted to likes and comments\n5. **Teacher** â€“ Wise, gives advice\n\n---\n\n**Scene 1: At Aryaâ€™s room**\n\n*(Arya is lying on the bed, scrolling on her phone. Sam enters.)*\n\n**Sam:** Hey Arya! Check my new post! I got 200 likes already!\n\n**Arya:** Wowâ€¦ thatâ€™sâ€¦ great. Wait, let me check mine. *[scrolls endlessly]*\n\n**Sam:** Youâ€™re always on your phone. Donâ€™t you get tired?\n\n**Arya:** Noâ€¦ I justâ€¦ I feel like if I stop, Iâ€™ll miss something important.\n\n*(Rohan knocks and enters.)*\n\n**Rohan:** Arya! Weâ€™re meeting Maya and friends for coffee. Come on, put your phone down for a while.\n\n**Arya:** Ummâ€¦ maybe later. Just a few more minutes.\n\n---\n\n**Scene 2: Living Room**\n\n*(Maya enters, notices Arya still on the phone.)*\n\n**Maya:** Arya, youâ€™ve been on that phone all day! You didnâ€™t eat lunch yet.\n\n**Arya:** Iâ€™ll eat laterâ€¦ Iâ€™m busy scrolling.\n\n**Maya:** Scrolling? Youâ€™re scrolling through life!\n\n**Arya:** What do you mean? Iâ€™m connecting with everyone!\n\n**Maya:** Youâ€™re connected online, but disconnected from us.\n\n---\n\n**Scene 3: Classroom / Teacherâ€™s Advice**\n\n*(Teacher notices Sam and Arya on phones during class.)*\n\n**Teacher:** Arya, Sam, phones away, please. Look around you. Life isnâ€™t a feed you can scroll endlessly.\n\n**Sam:** But teacher, likes and commentsâ€¦ they feel important.\n\n**Teacher:** True, but only real interactions give meaning. Too much time online can make you forget whatâ€™s real.\n\n**Arya:** Iâ€¦ I never thought of it that way.\n\n**Teacher:** Try a day without social media. Talk to friends, laugh, playâ€¦ live.\n\n---\n\n**Scene 4: Next Day â€“ Coffee with Friends**\n\n*(Arya, Rohan, Maya, and Sam are together, phones down.)*\n\n**Arya:** You knowâ€¦ yesterday I realized I was missing out on real moments.\n\n**Sam:** Me too. Likes donâ€™t make you happy. Friends do.\n\n**Maya:** Letâ€™s promise to enjoy life more than scrolling life away.\n\n**Rohan:** Agreed! No phones for a while!\n\n*(They all laugh and chat, enjoying the moment.)*\n\n---\n\n**Message at the End:**\n*\"Social media connects us, but real life experiences make us truly alive. Donâ€™t let scrolling steal your moments.\"*",
    
    "gemini-2.5": "## ðŸŽ­ Screen Life: A Skit on Social Media Addiction ðŸ“±\n\n---\n\n### **Characters**\n1.  **MAYA:** (17) Obsessively checks her phone, chasing 'likes'.\n2.  **LIAM:** (18) Maya's friend, constantly scrolling and multitasking.\n3.  **MR. SINGH:** (50s) A teacher, trying to have a real conversation.\n4.  **GRANDMA HELEN:** (70s) Liam's grandmother, observes the modern obsession.\n\n### **Setting**\nA park bench on a sunny afternoon.\n\n---\n\n### **The Skit**\n\n*(SCENE START)*\n\n*(MAYA and LIAM are sitting on a park bench. They are both engrossed in their phones. MR. SINGH is sitting nearby, reading a physical book.)*\n\n**MR. SINGH:** Ah, what a beautiful day! The sun is perfect.\n\n**(Maya and Liam don't look up, only offering a vague sound.)**\n\n**MAYA:** Yes, but did you see Chloe's story? She's at the beach. Ugh, I wish I was there. This park bench is so... *basic*.\n\n**LIAM:** Wait, wait. Someone just replied to my post. He called my new sneakers fake. I have to shut him down.\n\n**MR. SINGH:** Basic? Fake? Why don't you look up and appreciate the *real* view? Look at that treeâ€”it must be a hundred years old.\n\n**GRANDMA HELEN:** Hello, dear boys and girls. What lovely screens you have. They must be filled with such important things.\n\n**LIAM:** Hi, Grandma. Yeah, super important. Gotta check this new reel. It's only 15 seconds, but it feels like I'd miss everything if I didn't see it *right now*.\n\n**MAYA:** I missed a notification! Was it the 100th like? No, just an ad. **False alarm.** My heart jumped.\n\n**MR. SINGH:** They're trapped. Theyâ€™re chasing small digital rewards instead of big, real moments.\n\n**GRANDMA HELEN:** Connected? You're sitting inches apart, but you are miles away. Connection is eye contact. It's the scent of these flowers. It's Mr. Singh's book.\n\n**LIAM:** *(slowly lowers his phone)*\n\n**MAYA:** *(quietly)* My coffee isn't even that good.\n\n**LIAM:** Hey, Maya... did you finish that history project?\n\n**MAYA:** No, let's talk about it now.\n\n---\n\n### **Message of the Skit**\nSocial media is a useful tool, but when we chase endless likes and notifications, we forget to engage with the **real world** and the **real people** right in front of us. Don't let your screen be a barrier to genuine connection and the simple, beautiful moments of life. **Look up.**",
    
    "claude-3": "# THE BLUE LIGHT BLUES\n## A Skit About Social Media Addiction\n\n**CHARACTERS:**\n- MAYA: A teenager struggling with phone addiction\n- JAMES: Maya's concerned father\n- SOPHIE: Maya's best friend\n- DR. PATEL: A counselor\n- ALEX: A teenager trying to stay balanced\n\n---\n\n**SCENE 1: THE BREAKFAST TABLE**\n\n*(JAMES sits at the kitchen table with coffee. MAYA enters, eyes glued to her phone, walking slowly.)*\n\n**JAMES:** Good morning, Maya! Did you sleep well?\n\n**MAYA:** Oh, sorry Dad. What?\n\n**JAMES:** How did you sleep?\n\n**MAYA:** Fine. Wait, no... I only got like three hours. I was scrolling through posts until 2 AM.\n\n**JAMES:** Three hours? That's not okay. Put the phone down during breakfast.\n\n---\n\n**SCENE 2: AT SCHOOL - LUNCH TIME**\n\n*(MAYA sits with SOPHIE, both on phones.)*\n\n**SOPHIE:** Have you seen how many likes my photo got? 247! But I need like 500 to feel good about it.\n\n**ALEX:** Hey, can I sit here?\n\n**MAYA & SOPHIE:** Sure.\n\n**ALEX:** You two are not even eating. You're just scrolling.\n\n**MAYA:** *(shocked)* You DELETED your apps? How do you talk to people?\n\n**ALEX:** I text, call, and see people in person. I sleep better. My grades went up.\n\n---\n\n**SCENE 3: AT HOME - EVENING**\n\n**JAMES:** Have you finished your homework?\n\n**MAYA:** Yeah, I'll do it later.\n\n**JAMES:** Maya, you said that three hours ago.\n\n**MAYA:** Dad! Give it back! You don't understand!\n\n**JAMES:** Look at yourself. You're tired all the time. Grades slipping. Barely talk to me anymore.\n\n**MAYA:** I know, but... everyone else is on their phones.\n\n---\n\n**SCENE 4: DR. PATEL'S OFFICE**\n\n**DR. PATEL:** Social media is designed to make us keep coming back. Every like gives a little reward. It's like a trap.\n\n**MAYA:** So what do I do?\n\n**DR. PATEL:** Small changes help. Set phone-free times. Talk to friends about doing it together. Find other things that make you happy.\n\n**MAYA:** I want to try.\n\n---\n\n**SCENE 5: TWO WEEKS LATER - THE BREAKFAST TABLE**\n\n*(MAYA sits at the table without her phone.)*\n\n**MAYA:** Honestly? I feel lighter. I'm just being present. Here. With real people.\n\n**JAMES:** Proud of you.\n\n**SOPHIE:** We're starting a club called \"Digital Balance\".\n\n---\n\n## MESSAGE FOR THE AUDIENCE\nSocial media can be wonderful, but it needs balance. Likes and followers aren't measures of worth. Real connection happens face-to-face. **Your life is happening nowâ€”don't miss it by staring at a screen.**"
  },
  "last_updated": "2025-11-05"
}