{
  "id": "code-24",
  "title": "Data structure lister",
  "category": "coding",
  "goal": "List key data structures in a given language with details like description, examples, and time complexity.",
  "prompt": "List {count} {language} data structures in a tabular format. It should include columns, data structure name, description, examples and time complexity.",
  "variables": ["count", "language"],
  "tags": ["data-structures", "programming", "education"],
  "models_tested": ["gpt-5", "gemini-2.5", "claude-3"],
  "responses": {
    "gpt-5": "Hereâ€™s a clear tabular list of **3 common data structures in C** with their descriptions, examples, and time complexities:\n\n| **Data Structure Name** | **Description**                                                                                                                    | **Example**                                          | **Time Complexity (Average Case)**                                                                      |\n| ----------------------- | ---------------------------------------------------------------------------------------------------------------------------------- | ---------------------------------------------------- | ------------------------------------------------------------------------------------------------------- |\n| **Array**               | A collection of elements of the same data type stored in contiguous memory locations. Provides fast random access but fixed size.  | `int arr[5] = {1, 2, 3, 4, 5};`                      | Access: **O(1)** <br> Search: **O(n)** <br> Insertion: **O(n)** <br> Deletion: **O(n)**                 |\n| **Linked List**         | A linear collection of nodes where each node contains data and a pointer to the next node. Dynamic size but slower access.         | `struct Node { int data; struct Node* next; };` | Access: **O(n)** <br> Search: **O(n)** <br> Insertion: **O(1)** <br> Deletion: **O(1)** (if node known) |\n| **Stack**               | A linear data structure that follows the **LIFO (Last In, First Out)** principle. Elements are added or removed from the top only. | `push(10); push(20); pop();`                    | Push: **O(1)** <br> Pop: **O(1)** <br> Peek: **O(1)**                                                   |",
    "gemini-2.5": "C is a versatile language, and while it doesn't have built-in classes for complex data structures like some other languages, they are commonly implemented using arrays, pointers, and structs. Here are three fundamental C data structures:\n\n## ðŸ’¾ C Data Structures\n\n| Data Structure Name | Description | Examples (Implementation Concept) | Time Complexity (Common Operations) |\n| :--- | :--- | :--- | :--- |\n| **Array** | A collection of items of the **same data type** stored at **contiguous memory locations**. Access is done via an index. | `int arr[5] = {1, 2, 3, 4, 5};` (Fixed-size sequence of integers) | **Access:** $O(1)$ |\n| **Linked List** | A linear collection of data elements (called **nodes**), where each node points to the next node in the sequence. Nodes do **not** need to be in contiguous memory. | Implementing a **stack** or **queue** where elements are dynamically added/removed. | **Insertion/Deletion (at known position):** $O(1)$ |\n| **Hash Table** | An array of linked lists (or arrays, etc.) designed to store key-value pairs. It uses a **hash function** to compute an index into the array where the value is stored. | Implementing a **dictionary** or **map** for fast lookups based on a key (e.g., employee ID â†’ name). | **Average Case (Insertion/Search/Deletion):** $O(1)$ |\n\n---\n\n### **Key Concepts Explained**\n\n* **Time Complexity:** This refers to how the time taken by an algorithm to run grows as the input size (n) grows.\n* **Array Caveat:** While array access is $O(1)$, insertion or deletion in the middle is $O(n)$.\n* **Linked List Caveat:** Searching for a specific element is $O(n)$.\n* **Hash Table Caveat:** $O(1)$ average case, but $O(n)$ in the worst case due to collisions.",
    "claude-3": "I've created a comprehensive table showing 3 fundamental C data structures: Arrays, Linked Lists, and Stacks. Each row includes the data structure name, a detailed description of how it works, practical code examples, and the time complexity for common operations.\n\n| Data Structure Name | Description | Examples | Time Complexity |\n| -------------------- | ------------ | ---------- | ---------------- |\n| **Array** | A fixed-size collection of elements of the same type stored in contiguous memory locations. Elements are accessed via index. | `int arr[10]; char str[100];` | Access: O(1), Search: O(n), Insert: O(n), Delete: O(n) |\n| **Linked List** | A dynamic collection of nodes where each node contains data and a pointer to the next node. Provides flexible memory allocation. | `struct Node { int data; struct Node *next; };` | Access: O(n), Search: O(n), Insert: O(1), Delete: O(1) |\n| **Stack** | A Last-In-First-Out (LIFO) data structure where elements are added and removed from the same end (top). Follows push and pop operations. | `int stack[100]; int top = -1; stack[++top] = value;` | Push: O(1), Pop: O(1), Peek: O(1) |"
  },
  "last_updated": "2025-11-03"
}
